{
  "consulta": "q05_renda_por_vinculo.sql",
  "fonte": "batalha-time-02-lxof.hackathon_dados.extrato_sintetico",
  "medido_em": "2026-09-27T03:48 BRT",
  "autenticacao": "ADC",
  "job_id": "d9f99b9a-b94a-4f95-a396-e874a9a2141c",
  "bytes_processados": 34399658,
  "linhas": [
    {
      "vinculo": "MISTO",
      "faixa_salarial": "2. R$ 2.501 a R$ 5.000",
      "clientes": 95,
      "renda_media_mensal": 4545.64,
      "desvio_renda_entre_clientes": 245.03
    },
    {
      "vinculo": "MISTO",
      "faixa_salarial": "3. R$ 5.001 a R$ 10.000",
      "clientes": 404,
      "renda_media_mensal": 8491.97,
      "desvio_renda_entre_clientes": 626.14
    },
    {
      "vinculo": "MISTO",
      "faixa_salarial": "4. Acima de R$ 10.000",
      "clientes": 300,
      "renda_media_mensal": 11425.48,
      "desvio_renda_entre_clientes": 585.56
    },
    {
      "vinculo": "SÓ AUTÔNOMO",
      "faixa_salarial": "2. R$ 2.501 a R$ 5.000",
      "clientes": 96,
      "renda_media_mensal": 4544.41,
      "desvio_renda_entre_clientes": 238.23
    },
    {
      "vinculo": "SÓ AUTÔNOMO",
      "faixa_salarial": "3. R$ 5.001 a R$ 10.000",
      "clientes": 104,
      "renda_media_mensal": 6826.82,
      "desvio_renda_entre_clientes": 711.84
    },
    {
      "vinculo": "SÓ CLT",
      "faixa_salarial": "2. R$ 2.501 a R$ 5.000",
      "clientes": 1,
      "renda_media_mensal": 4128.7,
      "desvio_renda_entre_clientes": null
    }
  ]
}
